### ISSUE TITLE
Failed to get serverHello

### ISSUE THREAD

**Issue by lchannng** [HyNetwork/hysteria#203]
Occasionally...

with error

> timeout: no recent network activity

tcpdump on server side

> 13:25:09.290333 IP CLIENT_IP.60279 > SERVER_IP.21000: UDP, length 1268
13:25:09.292144 IP SERVER_IP.21000 > CLIENT_IP.60279: UDP, length 146
13:25:09.454120 IP CLIENT_IP.60279 > SERVER_IP.21000: UDP, length 1268
13:25:09.458973 IP SERVER_IP.21000 > CLIENT_IP.60279: UDP, length 1268
13:25:09.459327 IP SERVER_IP.21000 > CLIENT_IP.60279: UDP, length 1268
13:25:09.459708 IP SERVER_IP.21000 > CLIENT_IP.60279: UDP, length 1268
13:25:09.620862 IP CLIENT_IP.60279 > SERVER_IP.21000: UDP, length 56
13:25:09.621133 IP SERVER_IP.21000 > CLIENT_IP.60279: UDP, length 715
13:25:09.621208 IP CLIENT_IP.60279 > SERVER_IP.21000: UDP, length 1268
13:25:09.646871 IP CLIENT_IP.60279 > SERVER_IP.21000: UDP, length 56
13:25:10.056769 IP SERVER_IP.21000 > CLIENT_IP.60279: UDP, length 620
13:25:10.056868 IP SERVER_IP.21000 > CLIENT_IP.60279: UDP, length 620
13:25:10.926500 IP SERVER_IP.21000 > CLIENT_IP.60279: UDP, length 620
13:25:10.926548 IP SERVER_IP.21000 > CLIENT_IP.60279: UDP, length 620
13:25:12.665662 IP SERVER_IP.21000 > CLIENT_IP.60279: UDP, length 620
13:25:12.665704 IP SERVER_IP.21000 > CLIENT_IP.60279: UDP, length 620

tcpdump on client side
> 21:25:09.153580 IP CLIENT_IP.47427 > SERVER_IP.21000: UDP, length 1268
21:25:09.316553 IP SERVER_IP.21000 > CLIENT_IP.47427: UDP, length 146
21:25:09.316798 IP CLIENT_IP.47427 > SERVER_IP.21000: UDP, length 1268
21:25:09.483473 IP SERVER_IP.21000 > CLIENT_IP.47427: UDP, length 1268
21:25:09.483474 IP SERVER_IP.21000 > CLIENT_IP.47427: UDP, length 1268
21:25:09.483475 IP SERVER_IP.21000 > CLIENT_IP.47427: UDP, length 1268
21:25:09.483891 IP CLIENT_IP.47427 > SERVER_IP.21000: UDP, length 1268
21:25:09.483899 IP CLIENT_IP.47427 > SERVER_IP.21000: UDP, length 56
21:25:09.509287 IP CLIENT_IP.47427 > SERVER_IP.21000: UDP, length 56
21:25:09.645527 IP SERVER_IP.21000 > CLIENT_IP.47427: UDP, length 715
21:25:09.646469 IP CLIENT_IP.47427 > SERVER_IP.21000: UDP, length 123
21:25:09.646479 IP CLIENT_IP.47427 > SERVER_IP.21000: UDP, length 45
21:25:09.646515 IP CLIENT_IP.47427 > SERVER_IP.21000: UDP, length 113
21:25:09.646581 IP CLIENT_IP.47427 > SERVER_IP.21000: UDP, length 92
21:25:10.059447 IP CLIENT_IP.47427 > SERVER_IP.21000: UDP, length 90
21:25:10.059468 IP CLIENT_IP.47427 > SERVER_IP.21000: UDP, length 90
21:25:10.079740 IP SERVER_IP.21000 > CLIENT_IP.47427: UDP, length 620
21:25:10.079754 IP SERVER_IP.21000 > CLIENT_IP.47427: UDP, length 620
21:25:10.079983 IP CLIENT_IP.47427 > SERVER_IP.21000: UDP, length 56
21:25:10.884263 IP CLIENT_IP.47427 > SERVER_IP.21000: UDP, length 90
21:25:10.884271 IP CLIENT_IP.47427 > SERVER_IP.21000: UDP, length 90
21:25:10.950728 IP SERVER_IP.21000 > CLIENT_IP.47427: UDP, length 620
21:25:10.950729 IP SERVER_IP.21000 > CLIENT_IP.47427: UDP, length 620
21:25:10.950927 IP CLIENT_IP.47427 > SERVER_IP.21000: UDP, length 56
21:25:12.533918 IP CLIENT_IP.47427 > SERVER_IP.21000: UDP, length 90
21:25:12.533926 IP CLIENT_IP.47427 > SERVER_IP.21000: UDP, length 90
21:25:12.689752 IP SERVER_IP.21000 > CLIENT_IP.47427: UDP, length 620
21:25:12.689752 IP SERVER_IP.21000 > CLIENT_IP.47427: UDP, length 620
21:25:12.689967 IP CLIENT_IP.47427 > SERVER_IP.21000: UDP, length 56
21:25:15.833436 IP CLIENT_IP.47427 > SERVER_IP.21000: UDP, length 90
21:25:15.833444 IP CLIENT_IP.47427 > SERVER_IP.21000: UDP, length 90
21:25:22.432450 IP CLIENT_IP.47427 > SERVER_IP.21000: UDP, length 90
21:25:22.432459 IP CLIENT_IP.47427 > SERVER_IP.21000: UDP, length 90
21:25:35.631165 IP CLIENT_IP.47427 > SERVER_IP.21000: UDP, length 90
21:25:35.631172 IP CLIENT_IP.47427 > SERVER_IP.21000: UDP, length 90

**Comment by tobyxdd** [comment]
Doesn't seem to be a problem with hysteria itself but with your connection. All the packets sent from the client 21:25:12.689967 onwards were not received by the server.
